{
  "schema_version": "0.1.0",
  "track_id": "002-public-source-acquisition",
  "reviewed_commit": "0000000000000000000000000000000000000000",
  "evidence_manifest_sha256": "0000000000000000000000000000000000000000000000000000000000000000",
  "panel_roles": ["methods/source", "data-governance/security", "clinical/metrics"],
  "findings": ["Exact source terms and scientific dispositions remain pending."],
  "dissent": [],
  "recommendation": "prepare",
  "accountable_gate_status": "pending",
  "requested_receipts": ["scientific disposition", "custodian terms and conditions"]
}
